<?xml version="1.0" encoding="UTF-8"?>
<?xml-stylesheet type="text/css" href="/estilos/ejercicio-ii-1a-dtd.css" ?>
<!-- ejemplodtd1.xml -->

<!DOCTYPE fichero SYSTEM "dtd1a.dtd">
<fichero>
	<a xmlns="http://www.w3.org/1999/xhtml" href="/index.html" target="marco">INICIO</a>
 	<ficha>
  		<nombre sexo="femenino" edad="17">Angelina</nombre>
  		<apellido>Fernandez</apellido>
  		<direccion>c/Ulises, 36</direccion>
  		<DUI>54986235-3</DUI>
  		<telefono tipo="celular">7456-2318</telefono>
		<correo>fermandez@mail.com</correo>
		<pais idioma="Español">El Salvador</pais>
 	</ficha>
</fichero>
